{
  "$schema": "http://json-schema.org/draft-07/schema#",
  "$id": "https://example.com/flow.schema.json",
  "type": "object",
  "required": ["id", "version", "nodes", "edges"],
  "properties": {
    "id": { "type": "string" },
    "version": { "type": "string" },
    "nodes": {
      "type": "array",
      "items": {
        "type": "object",
        "required": ["id", "type", "name", "params", "in", "out"],
        "properties": {
          "id": { "type": "string" },
          "type": { "type": "string" },
          "name": { "type": "string" },
          "params": { "type": "object" },
          "in": {
            "type": "array",
            "items": {
              "type": "object",
              "required": ["port", "types"],
              "properties": {
                "port": { "type": "string" },
                "types": { "type": "array", "items": { "type": "string" } }
              }
            }
          },
          "out": {
            "type": "array",
            "items": {
              "type": "object",
              "required": ["port", "types"],
              "properties": {
                "port": { "type": "string" },
                "types": { "type": "array", "items": { "type": "string" } }
              }
            }
          }
        }
      }
    },
    "edges": {
      "type": "array",
      "items": {
        "type": "object",
        "required": ["id", "from", "to"],
        "properties": {
          "id": { "type": "string" },
          "from": {
            "type": "array",
            "items": [{ "type": "string" }, { "type": "string" }],
            "minItems": 2,
            "maxItems": 2
          },
          "to": {
            "type": "array",
            "items": [{ "type": "string" }, { "type": "string" }],
            "minItems": 2,
            "maxItems": 2
          },
          "label": { "type": "string" }
        }
      }
    },
    "prompts": { "type": "object" },
    "models": { "type": "object" },
    "profiles": { "type": "object" }
  }
}

